{
  "id": "google",
  "name": "Google AI Studio",
  "status": "active",
  "signupUrl": "https://aistudio.google.com",
  "docsUrl": "https://ai.google.dev/gemini-api/docs",
  "auth": {
    "envVar": "GOOGLE_GENERATIVE_AI_API_KEY",
    "header": "Authorization: Bearer"
  },
  "freeTier": {
    "type": "perpetual",
    "limits": {
      "tpm": 250000
    },
    "notes": "Per-project enforcement. Keys from different GCP projects get independent quota. Per-model RPM/RPD limits vary significantly."
  },
  "sdk": {
    "package": "@ai-sdk/google",
    "type": "official"
  },
  "models": [
    {
      "id": "gemini-2.5-flash",
      "free": true,
      "capabilities": ["tools", "reasoning", "vision", "structuredOutput"],
      "tier": "frontier",
      "contextWindow": 1048576,
      "maxOutputTokens": 65536,
      "limits": {
        "rpm": 10,
        "rpd": 250,
        "tpm": 250000
      }
    },
    {
      "id": "gemini-2.5-pro",
      "free": true,
      "capabilities": ["tools", "reasoning", "vision", "structuredOutput"],
      "tier": "frontier",
      "contextWindow": 1048576,
      "maxOutputTokens": 65536,
      "limits": {
        "rpm": 5,
        "rpd": 100,
        "tpm": 250000
      }
    },
    {
      "id": "gemini-2.5-flash-lite",
      "free": true,
      "capabilities": ["tools", "vision", "structuredOutput"],
      "tier": "high",
      "contextWindow": 1048576,
      "maxOutputTokens": 65536,
      "limits": {
        "rpm": 15,
        "rpd": 1000,
        "tpm": 250000
      }
    },
    {
      "id": "gemini-3-flash-preview",
      "free": true,
      "capabilities": ["tools", "reasoning", "vision", "structuredOutput"],
      "tier": "frontier",
      "contextWindow": 1048576,
      "maxOutputTokens": 65536,
      "limits": {
        "rpm": 5,
        "rpd": 20,
        "tpm": 250000
      }
    }
  ],
  "notes": [
    "Per-project enforcement -- create multiple GCP projects for independent quotas",
    "Some models have 0/0/0 limits on free tier (unavailable)",
    "Free tier may use data for model improvement outside EU"
  ],
  "lastVerified": "2026-03-15",
  "verifiedBy": "manual"
}
